Lead first name,Lead last name,Lead LinkedIn URL,Lead location,Lead summary,Lead company name,Lead company URL,Lead position,Lead about,Sender first name,Sender last name,Sender LinkedIn URL,Last action taken,Last action time,Sender Status,Tags,Failed Reason Code
Michael,Kanaby,https://www.linkedin.com/in/michaelkanaby,Greater Tampa Bay Area,I help $35M-$1B+ trade contractors protect and grow predictable EBITDA while scaling operations | Public Speaker and Author of “Building Excellence”.,Profitability Works Inc.,,Managing Partner,,Ian,Shaw,https://www.linkedin.com/in/ianshaw93,MESSAGE,01/02/2026 16:52:23,AWAITING_REPLY,replied,
Sagar,Lakhani,https://www.linkedin.com/in/sagardlakhani,"La Mirada, California, United States",Salaried HR Manager🔹Seasoned Matchmaker Between Employer Needs & Employee Desires🔹Helping to Consistently Keep Employers Compliant & Litigation-Free🔹Experienced Career Coach🔹Expert in Wage & Hour and Employment Law,Loanmax Bancorp,https://www.linkedin.com/company/insulation-supply-company,Human Resources Business Partner,"I've been in the field of human resources (HR) since September 2013!  ✥ I AM CURRENTLY: An HR Manager at Insulation Supply Company (INSCO).  ✥ MY STORY: As an experienced HR & payroll professional, I have continually researched employment legislation to ensure that the company is fully protected. I have eliminated potential employment-related issues from arising (i.e., litigation) in the future and helped eliminate counter-productive business practices that are not contributing to the company's mission. I iterate the decision-making plans, so that the firm can adjust to changing circumstances. I have done detailed cost-benefit analyses & sought out the best course of action & executed these decisions as quickly as possible and have been told that I am highly capable & bring levelheaded expertise to any given situation.  ✥ I CAN ADD VALUE FOR YOU WITH MY KNOWLEDGE IN: ✔ Employment Law & Compliance ✔ Payroll Processing ✔ Strategic Planning  ✥ PEOPLE DESCRIBE ME AS: ✔ a driving force in learning about California labor laws, practices & procedures ✔ detail-oriented & thorough; an attentiveness to detail, impeccable time management skills, & innovative thought processes  ✥ EXPERTISE IN SOFTWARE: ✔ Payroll Platforms: ADP; Gusto; QuickBooks; iSolved; OnPay; Paylocity; SubSource; WagePro ✔ HRIS Platforms: ADP; SubSource; TalentForce ✔ Microsoft Office: Word; Excel; PowerPoint; Outlook ✔ Google: Drive; Gmail; Keep; Docs; Sheets; Slides  ✥ HR PROJECTS I'VE COMPLETED SO FAR IN MY CAREER: 📄 Claims ♻️ Culture Change 🤗 Employee Experience 📓 Employee Learning 📙 Employee Training & Development 💼 Employment Litigation 👔 Hiring Practices 🍽 Meal Break Compliance 📎 Onboarding 🏅 Performance Management 🗄 Personnel File Management 🦺 Safety Training ⏰ Wage and Hour Audit  The key is to keep the organization compliant.  ✥ HELP CANDIDATES WITH: ✍🏽 Resumes, 🖊 Cover Letters, 👨‍💻 LinkedIn Profiles, 📋 Interviewing, 🤝 Salary/Compensation Negotiations, ✏️ Skills Assessment, 💡 Job Advice, and 🌉 the Job Application Process  🧲 The key is to become an attractive candidate in the eyes of the hiring manager.  ✥ FEEL FREE TO CONTACT ME: ✔ Email: sagardlakhani@gmail.com ✔ Cell: (562) 883-5465  Please note that opinions are my own and not the view of my employer.  Thank you for viewing my LinkedIn profile! Please feel free to connect and/or follow me!",Ian,Shaw,https://www.linkedin.com/in/ianshaw93,MESSAGE,01/02/2026 12:37:16,REPLIED,replied,
Alessandro,Petroni,https://www.linkedin.com/in/apetroni,New York City Metropolitan Area,FinServ emerging tech & AI Specialist | payments | capital markets | publisher | AI Startup co-founder,The Clearing House,,Head of Quality Engineering - Fraud Payment Services,I am an accomplished professional with over two decades of expertise in financial… see more,Ian,Shaw,https://www.linkedin.com/in/ianshaw93,MESSAGE,01/02/2026 12:35:46,AWAITING_REPLY,replied,
Bill,Brown,https://www.linkedin.com/in/billbrown11,"Southport, North Carolina, United States","SVP, Revenue | Sales, CS, Presales & RevOps at Devtron | 20+ Years Expert in High-Growth SaaS | Driving 5x Revenue -​> 8 and 9-Figure ARR+CLTV | Advisory Board Member | Speaker | Coach | Small Business Owner | ENTP",Devtron Inc.,https://www.linkedin.com/company/devtron-labs/,"SVP, Revenue | Sales, CS, Presales & Ops","🚀 As a strategic architect in sales and client relations, my career has been dedicated… see more",Ian,Shaw,https://www.linkedin.com/in/ianshaw93,MESSAGE,01/06/2026 16:49:50,AWAITING_REPLY,replied,
Thomas,Philbrick,https://www.linkedin.com/in/thomas-philbrick-33b59a77,"Boothbay, Maine, United States",Business owner/operator. The Boothbay Lobster Wharf Inc./ Philbrick Lobster Co. Inc.,Owner/Operator Boothbay Lobster Wharf/Philbrick Lobster Co.,,Business Owner," ",Ian,Shaw,https://www.linkedin.com/in/ianshaw93,MESSAGE,01/02/2026 12:36:41,AWAITING_REPLY,replied,
Tannen,Ellis-Graham,https://www.linkedin.com/in/tanneng,"Sandy, Utah, United States",Founder and Strategic Leader. CEO. Goldman Sachs 10K Small Business Alumni. Executive Resilience. Career Reinvention. EQ-i Emotional Intelligence Mentor,"Diabetes & Endocrine Treatment Specialists + ReSet ",,Founder/CEO,"As Founder/CEO of Diabetes & Endocrine Treatment Specialists, I channel my passion for… see more",Ian,Shaw,https://www.linkedin.com/in/ianshaw93,MESSAGE,01/04/2026 08:01:45,AWAITING_REPLY,replied,
Carlos,Ponce,https://www.linkedin.com/in/carlosponcerobles,"Tucson, Arizona, United States",Business Development Specialist | Podcast Producer | Communicator | Managing Partner at Peoplebound,HUMANITY'S TEAM,,Volunteer,,Ian,Shaw,https://www.linkedin.com/in/ianshaw93,MESSAGE,01/02/2026 16:48:51,REPLIED,replied,
Lisa,Ashman,https://www.linkedin.com/in/lisaashmaninc,"Victor, New York, United States","  Lisa Ashman is a dynamic professional driven by a profound purpose: to address and resolve the ongoing mortgage crisis by harnessing the power of data, a proprietary formula, and artificial intelligence (AI). Her vision extends beyond mere problem-solving, aiming to provide relief and speedier resolutions to the burdens that foreclosures impose on individuals, lawyers, bankers, the mortgage industry, and the judges involved. Lisa's primary mission is to combat the challenges of the mortgage crisis that have plagued communities and individuals for years. She has dedicated her last 7 years of her career developing a groundbreaking formula, supported by cutting-edge AI technology, designed not only to identify errors but to also facilitate the alleviation of foreclosure-related burdens. Lisa leverages her expertise in AI to create innovative tools that go beyond error detection. Her AI-driven systems analyze vast datasets, pinpoint inconsistencies, and provide actionable insights to streamline the foreclosure process. These tools are invaluable to lawyers, bankers, and mortgage industry professionals, enabling them to make more informed decisions and expedite case resolutions.  My mission is to leverage my diverse and extensive background to create innovative solutions that can benefit consumers, collectors, and agencies in the dynamic and rapidly evolving landscape of today's economy.",Lexington Capital Holdings,,Funding partner,"I am the founder and president of Lisa Ashman Inc, a company that provides software and… see more",Ian,Shaw,https://www.linkedin.com/in/ianshaw93,MESSAGE,01/02/2026 12:36:31,AWAITING_REPLY,replied,
April,Hayes,https://www.linkedin.com/in/april-hayes-081a73158,United States,"Entrepreneur, High Performance Mentor of Mindset | Coaching for Business, Personal and Professional","Dynamite Lifestyle ",,"Entrepreneur, Investor, Mentor of Mindset",,Ian,Shaw,https://www.linkedin.com/in/ianshaw93,MESSAGE,01/02/2026 16:50:55,REPLIED,replied,
